[
  {
    "id": "QA-2026-001",
    "year": 2026,
    "question_nl": "Hoeveel belasting betaal ik als ZZP'er met €50.000 winst in 2026?",
    "question_en": "How much tax will I pay as a ZZP freelancer with €50,000 profit in 2026?",
    "question_fa": "اگر ZZP‌کار هستم و ۵۰٬۰۰۰ یورو سود دارم در ۲۰۲۶ چقدر مالیات می‌پردازم؟",
    "question_variants": [
      "Wat is mijn belasting bij €50k omzet als freelancer?",
      "ZZP belasting berekenen 2026 €50000",
      "hoeveel moet ik reserveren voor belasting als zzp 50000 omzet"
    ],
    "answer": {
      "short_nl": "Ongeveer €10.000-€13.000 afhankelijk van je aftrekposten — plan 25-28% te reserveren.",
      "short_en": "Approximately €10,000-€13,000 depending on deductions — budget to reserve 25-28%.",
      "short_fa": "تقریباً ۱۰٬۰۰۰ تا ۱۳٬۰۰۰ یورو بسته به کسرها — ۲۵ تا ۲۸٪ ذخیره کنید.",
      "detailed_nl": "Bij €50.000 winst en standaard ZZP-aftrekposten: Zelfstandigenaftrek €1.200, MKB-winstvrijstelling 12,7% = €6.200, Belastbaar inkomen: ~€42.600. Box 1 belasting vóór kortingen: ~€15.230. Na algemene heffingskorting (~€1.900) en arbeidskorting (~€3.600): ~€9.730 inkomstenbelasting. Plus ZVW 5,32% over €42.600 = ~€2.266. Totaal: ~€12.000. Maandelijkse reservering: €1.000/maand.",
      "detailed_en": "With €50,000 profit and standard ZZP deductions: After zelfstandigenaftrek (€1,200) and MKB-winstvrijstelling (12.7%), taxable income is ~€42,600. Box 1 tax before credits ~€15,230. After AHK and arbeidskorting: ~€9,730 income tax + ZVW €2,266 = total ~€12,000.",
      "detailed_fa": "با ۵۰٬۰۰۰ یورو سود و کسرهای استاندارد ZZP: ابتدا zelfstandigenaftrek (۱٬۲۰۰ یورو) کم می‌شود، سپس MKB-winstvrijstelling (۱۲.۷٪) اعمال می‌شود. درآمد مشمول مالیات: ~۴۲٬۶۰۰ یورو. مالیات باکس ۱ قبل از تخفیف‌ها: ~۱۵٬۲۳۰ یورو. پس از algemene heffingskorting (~۱٬۹۰۰ یورو) و arbeidskorting (~۳٬۶۰۰ یورو): ~۹٬۷۳۰ یورو مالیات بر درآمد. به علاوه ZVW (۵.۳۲٪ بر سود): ~۲٬۲۶۶ یورو. مجموع: ~۱۲٬۰۰۰ یورو. توصیه: ماهانه ۱٬۰۰۰ یورو کنار بگذارید.",
      "numeric_answer": 12000,
      "conditions_that_change_answer": [
        "If eligible for startersaftrek (€2,123 extra): reduces bill by ~€800",
        "If has children under 12: IACK can reduce by up to €3,032",
        "If made KIA-eligible investments: additional savings",
        "If contributed to lijfrente/pension: significant additional deduction possible"
      ]
    },
    "rule_ids": ["BR1-2026-001", "BR1-2026-003", "ZA-2026-001", "MKB-2026-001", "AHK-2026-001", "AK-2026-001", "ZVW-2026-001"],
    "source_url": "https://www.belastingdienst.nl/wps/wcm/connect/bldcontentnl/belastingdienst/zakelijk/",
    "source_type": "synthetic",
    "user_types": ["zzp"],
    "tags": ["tax_calculation", "zzp", "50k_profit", "estimation"],
    "difficulty": "intermediate",
    "verification_status": "verified",
    "expected_ai_behavior": "answer_with_caveat"
  },
  {
    "id": "QA-2026-002",
    "year": 2026,
    "question_nl": "Wat is de zelfstandigenaftrek in 2026 en hoe werkt het urencriterium?",
    "question_en": "What is the zelfstandigenaftrek in 2026 and how does the hours requirement work?",
    "question_fa": "zelfstandigenaftrek در ۲۰۲۶ چیست و urencriterium چگونه کار می‌کند؟",
    "question_variants": [
      "hoeveel is de zelfstandigenaftrek 2026",
      "1225 uren eis zzp 2026",
      "wat telt als ondernemersuren zzp"
    ],
    "answer": {
      "short_nl": "€1.200 in 2026. Je moet minimaal 1.225 uur per jaar aan je bedrijf besteden.",
      "short_en": "€1,200 in 2026. You must spend at least 1,225 hours/year on your business.",
      "short_fa": "۱٬۲۰۰ یورو در ۲۰۲۶. باید حداقل ۱٬۲۲۵ ساعت در سال در کسب‌وکارتان کار کنید.",
      "detailed_nl": "De zelfstandigenaftrek is €1.200 in 2026 (was €2.470 in 2025, wordt €900 in 2027). Om in aanmerking te komen moet je het urencriterium halen: minimaal 1.225 uur per jaar aan je onderneming besteden. Wat telt? Declarabele uren, administratie, acquisitie, netwerken, reistijd naar klanten, scholing. Wat telt NIET? Persoonlijke vakanties, ziektedagen, privé-tijd. Tip: houd een urenregistratie bij — dat is ook vereist als de Belastingdienst controleert.",
      "detailed_en": "€1,200 in 2026. The urencriterium requires 1,225+ hours/year. This includes: billable client hours, administration, invoicing, marketing, client travel, professional training. Does NOT include: personal vacation, sick days, private time.",
      "detailed_fa": "zelfstandigenaftrek در ۲۰۲۶ مبلغ ۱٬۲۰۰ یورو است (در ۲۰۲۵ برابر ۲٬۴۷۰ یورو بود و در ۲۰۲۷ به ۹۰۰ یورو کاهش می‌یابد). برای دریافت این کسر باید حداقل ۱٬۲۲۵ ساعت در سال برای کسب‌وکارتان کار کنید (urencriterium). ساعاتی که حساب می‌شوند: ساعات قابل صدور فاکتور به مشتری، امور اداری و حسابداری، بازاریابی و اکتساب مشتری، مسافرت به مشتری، آموزش حرفه‌ای. ساعاتی که حساب نمی‌شوند: تعطیلات شخصی، روزهای بیماری، اوقات خصوصی. نکته مهم: ثبت دقیق ساعات کار را نگه دارید — Belastingdienst ممکن است در بازرسی آن را درخواست کند.",
      "numeric_answer": 1200,
      "conditions_that_change_answer": [
        "If at AOW retirement age on 1 Jan 2026: only 50% applies = €600",
        "If you don't meet the 1,225 hour requirement: no zelfstandigenaftrek at all"
      ]
    },
    "rule_ids": ["ZA-2026-001"],
    "source_url": "https://www.belastingdienst.nl/wps/wcm/connect/bldcontentnl/belastingdienst/zakelijk/winst/ondernemersaftrek/zelfstandigenaftrek/",
    "source_type": "synthetic",
    "user_types": ["zzp"],
    "tags": ["zelfstandigenaftrek", "urencriterium", "deduction"],
    "difficulty": "beginner",
    "verification_status": "verified",
    "expected_ai_behavior": "answer_directly"
  },
  {
    "id": "QA-2026-003",
    "year": 2026,
    "question_nl": "Is 2026 echt het laatste jaar voor de startersaftrek?",
    "question_en": "Is 2026 really the last year for the startersaftrek?",
    "question_fa": "آیا ۲۰۲۶ واقعاً آخرین سال startersaftrek است؟",
    "question_variants": [
      "startersaftrek 2027 afgeschaft?",
      "kan ik nog startersaftrek claimen 2026",
      "startersaftrek nog van toepassing mijn eerste jaar"
    ],
    "answer": {
      "short_nl": "Ja. Startersaftrek wordt per 1 januari 2027 definitief afgeschaft. 2026 is de laatste kans.",
      "short_en": "Yes. Startersaftrek is definitively abolished from 1 January 2027. 2026 is the last opportunity.",
      "short_fa": "بله. Startersaftrek از اول ژانویه ۲۰۲۷ قطعاً لغو می‌شود. ۲۰۲۶ آخرین فرصت است.",
      "detailed_nl": "Ja, dit is bevestigd in de Wet IB 2026. Startersaftrek bedraagt €2.123 in 2026 en kun je maximaal 3 keer gebruiken in de eerste 5 jaar van ondernemerschap. Als je nog gebruik kunt maken van de startersaftrek in 2026 — maak dat dan zeker! De besparing is ongeveer €800 bij een tarief van ~37%. Combineer dit met de zelfstandigenaftrek van €1.200 voor €3.323 totale ondernemersaftrek.",
      "detailed_en": "Yes, confirmed in legislation. €2,123 in 2026. Use it if you're in the first 5 years and have used it fewer than 3 times. Combined with zelfstandigenaftrek (€1,200) gives total ondernemersaftrek of €3,323 — saving approximately €1,249 in taxes.",
      "detailed_fa": "بله، در قانون مالیاتی ۲۰۲۶ (Wet IB) رسماً تأیید شده است. startersaftrek در ۲۰۲۶ مبلغ ۲٬۱۲۳ یورو است و می‌توانید حداکثر ۳ بار در ۵ سال اول کارآفرینی از آن استفاده کنید. اگر هنوز واجد شرایط هستید، حتماً در ۲۰۲۶ از آن استفاده کنید — این آخرین فرصت است. این کسر روی zelfstandigenaftrek (۱٬۲۰۰ یورو) اضافه می‌شود و مجموع ondernemersaftrek را به ۳٬۳۲۳ یورو می‌رساند. در نرخ مالیاتی ~۳۷٪، این صرفه‌جویی حدود ۱٬۲۳۰ یورو در مالیات است.",
      "conditions_that_change_answer": [
        "Already used startersaftrek 3 times: no longer eligible",
        "More than 5 years of entrepreneurship: no longer eligible",
        "Did not meet urencriterium (1,225 hours): not eligible"
      ]
    },
    "rule_ids": ["SA-2026-001", "ZA-2026-001"],
    "source_url": "https://www.belastingdienst.nl/wps/wcm/connect/bldcontentnl/belastingdienst/zakelijk/winst/ondernemersaftrek/startersaftrek/",
    "source_type": "reddit_r_dutchtaxes",
    "user_types": ["zzp"],
    "tags": ["startersaftrek", "abolished_2027", "starter", "urgent"],
    "difficulty": "beginner",
    "verification_status": "verified",
    "expected_ai_behavior": "answer_directly"
  },
  {
    "id": "QA-2026-004",
    "year": 2026,
    "question_nl": "Wat is de ZVW-bijdrage en waarom staat dit niet op mijn belastingaangifte vooringevuld?",
    "question_en": "What is the ZVW contribution and why isn't it pre-filled on my tax return?",
    "question_fa": "ZVW چیست و چرا در اظهارنامه مالیاتی از قبل پر نشده است؟",
    "question_variants": [
      "ZVW zelfstandigen 2026 hoeveel",
      "bijdrage zvw zzp niet ingevuld",
      "wat is het zvw tarief 2026 voor zzp"
    ],
    "answer": {
      "short_nl": "De ZVW-bijdrage is 5,32% over je winst (max €71.628). Dit staat los van Box 1 maar wordt via de aangifte IB berekend.",
      "short_en": "ZVW is 5.32% on profit up to €71,628. It's separate from Box 1 but calculated via the IB return.",
      "short_fa": "ZVW برابر ۵.۳۲٪ از سود تا ۷۱٬۶۲۸ یورو است. جدا از مالیات باکس ۱ اما از طریق اظهارنامه IB محاسبه می‌شود.",
      "detailed_nl": "De ZVW (Zorgverzekeringswet) bijdrage voor zelfstandigen is 5,32% in 2026, berekend over je winst uit onderneming tot een maximum van €71.628. Maximale bijdrage: ~€3.811. Het wordt NIET vooringevuld omdat de Belastingdienst je winst pas definitief weet na je aangifte. Het wordt berekend naast je Box 1 belasting. Vergeet het niet te reserveren — het staat apart op de eindafrekening en verrast veel ZZP'ers.",
      "detailed_en": "5.32% on profit up to €71,628 = max ~€3,811/year. Not pre-filled because Belastingdienst doesn't know your final profit until you file. Calculated alongside Box 1 tax but shown separately on the final assessment.",